<?xml version="1.0" encoding="UTF-8"?>

<!ELEMENT shardingConfig (ignoreList?,parseList?,strategy*)>
<!ELEMENT ignoreList (value+)>
<!ELEMENT parseList (value+)>
<!ELEMENT value (#PCDATA)>
<!ELEMENT strategy EMPTY>
<!ATTLIST strategy
tableName CDATA #REQUIRED
strategyClass CDATA #REQUIRED
>